e___2HP4,AXIS WAY btwn FERN CASEY ST & LYNN VALLEY TERR (e___2HP4),2022,1616,382300.7568,5033683.11,45.438784,-75.509383,215
e___2HV5,HEPATICA WAY btwn GENEVRIERS ST & MAGNOLIA ST (e___2HV5),2022,217,384341.7237,5034538.382,45.44625,-75.483161,216
e___2HV1,HEPATICA WAY btwn DES AUBEPINES DR & MAGNOLIA ST (e___2HV1),2022,230,384364.1338,5034378.108,45.444805,-75.482901,217
__3ZA3M4,NAVAN RD (__3ZA3M4),2022,3806,388091.3484,5032188.503,45.424671,-75.435633,218
__42HNW4,NAVAN RD btwn INNES RD & ORLEANS BLVD (__42HNW4),2022,13779,380115.0327,5033202.246,45.434696,-75.537391,219
__3ZA3XS,NAVAN RD btwn CANARY ST & MILTON RD (__3ZA3XS),2022,7025,386984.0298,5031762.903,45.420973,-75.449852,220
__3ZA3Y0,NAVAN RD btwn CANARY ST & TENTH LINE RD (__3ZA3Y0),2022,7507,386225.067,5031860.095,45.421936,-75.459532,221
__3ZA3Q3,BANK ST btwn JAMES ST & WAVERLEY ST (__3ZA3Q3),2022,8996,367841.206,5030686.57,45.413275,-75.694568,222
__3ZA3BB,SOMERSET ST    W btwn BAY ST & LYON ST N (__3ZA3BB),2022,6897,367307.4291,5030682.729,45.413289,-75.701388,223
__3ZA341,SOMERSET ST    W btwn ELGIN ST & METCALFE ST (__3ZA341),2022,3845,368087.7066,5031151.574,45.417437,-75.69136,224
__3ZA3B9,GLADSTONE AVE btwn BRONSON AVE & PERCY ST (__3ZA3B9),2022,6683,367229.4062,5030146.388,45.40847,-75.702453,225
__3ZA3QC,GLADSTONE AVE btwn ELGIN ST & METCALFE ST (__3ZA3QC),2022,2839,368307.7079,5030797.571,45.414232,-75.688595,226
__3ZA8XI,GENEST ST btwn MARIER AVE & ST. CHARLES ST (__3ZA8XI),2022,370,369681.2071,5033718.096,45.440384,-75.670663,227
__3ZA8XX,ALICE ST btwn DAGMAR AVE & VACHON AVE (__3ZA8XX),2022,527,369776.2071,5033696.095,45.440177,-75.669452,228
__3ZAAIZ,BAYSWATER AVE btwn LAUREL ST & SOMERSET ST W (__3ZAAIZ),2022,3431,365862.7663,5029801.66,45.405489,-75.719953,229
__3ZA42DB,MARCH RD btwn 280 S OF CARLING AVE/GATEWAY MALL SC & TERON RD (__3ZA42DB),2022,25148,351251.2435,5021876.196,45.335296,-75.907342,230
__3ZACT4,JOCK TR btwn MUNSTER RD & WOOD'S RD (__3ZACT4),2022,102,350854.2016,4999162.775,45.130938,-75.914509,231
__3ZABO9,MIDLAND CRES btwn HALLOWELL CRT & MOSS CRT (__3ZABO9),2022,307,361197.3394,5020477.115,45.321978,-75.780611,232
__3ZA0CV,BENJAMIN AVE btwn BLYTHDALE RD & FAIRLAWN AVE (__3ZA0CV),2022,230,362320.6496,5025188.296,45.364278,-75.765735,233
__49AYVZ,TAUVETTE ST (__49AYVZ),2022,645,377236.6095,5032740.859,45.430849,-75.574243,234
__3ZA5QH,GREENLAND RD btwn PINE VALLEY CRT & VENTURI BLVD (__3ZA5QH),2022,518,341458.8513,5036712.004,45.469373,-76.031172,235
__3ZA42C,MARCH RD btwn HERZBERG RD & TERON RD (__3ZA42C),2022,25319,351874.5493,5021668.568,45.333386,-75.899409,236
__3ZA3XQ,RIDEAU ST btwn CHARLOTTE ST & WURTEMBURG ST (__3ZA3XQ),2022,5109,369305.0789,5032892.034,45.432986,-75.675579,237
__3ZBPLT,RIDEAU ST btwn MONTREAL RD & RIDEAU PL (__3ZBPLT),2022,14984,369584.0832,5032940.663,45.433398,-75.672007,238
__3ZA1LA,RIDEAU ST btwn RIDEAU PL & WURTEMBURG ST (__3ZA1LA),2022,13839,369439.4871,5032965.945,45.433639,-75.673851,239
__3ZBOI9,MALVERN DR btwn THISTLEDOWN CRT & TRIPP CRES (__3ZBOI9),2022,5083,363138.7128,5016055.102,45.282031,-75.756369,240
__3ZA9P3,JEFFERSON ST btwn ARIZONA AVE & LORRAINE AVE (__3ZA9P3),2022,2354,371795.7279,5027176.537,45.381326,-75.644527,241
__3ZA6V9,9TH LINE RD btwn SPRINGHILL RD & VICTORIA ST (__3ZA6V9),2022,419,387888.0935,5010314.256,45.227889,-75.4419,242
__3ZAZ7M,DONWEL DR btwn BUSH DR & STEPHANIE ANNE DR (__3ZAZ7M),2022,226,378794.6966,5013199.255,45.254861,-75.557256,243
__8JUUSV,LOMBARDY DR btwn LOGAN FARM DR & REIDS LANE (__8JUUSV),2022,177,375007.1106,5001456.313,45.149589,-75.607161,244
__3ZAZFL,BLAIR RD btwn OR174 IC112 RAMP26 & OR174 IC112 RAMP52 (__3ZAZFL),2022,28212,374785.2682,5032811.245,45.431732,-75.605558,245
__3ZA2E1,BLAIR RD btwn MEADOWBROOK RD & OR174 IC112 RAMP15 (__3ZA2E1),2022,21748,375053.231,5032484.072,45.428761,-75.60218,246
__3ZBN93,BLAIR RD btwn BEAVERPOND DR & LAURA PRIV (__3ZBN93),2022,15831,375349.3494,5032003.417,45.424407,-75.598465,247
__3ZA9IT,WILLARD ST btwn BELMONT AVE & SUNNYSIDE AVE (__3ZA9IT),2022,306,368840.78,5028544.121,45.393908,-75.682077,248
__3ZA9IL,BELMONT AVE btwn BANK ST & WILLARD ST (__3ZA9IL),2022,952,368842.7135,5028447.05,45.393034,-75.682065,249
e___2JWG,DECOEUR DR btwn DE L'ESTURGEON ST & MOUNTAIN SORREL WAY (e___2JWG),2022,3513,,,,,250
__3ZA0IN,DAWSON AVE btwn IONA ST & WESLEY AVE (__3ZA0IN),2022,105,363907.2065,5028223.252,45.391454,-75.745121,251
__3ZA9I4,FAIRBAIRN ST btwn BELMONT AVE & SUNNYSIDE AVE (__3ZA9I4),2022,176,368907.2135,5028583.55,45.394256,-75.681224,252
__3ZA8HL,PRESLAND RD btwn FRANCES ST & NAUGHTON ST (__3ZA8HL),2022,759,371453.2176,5031917.576,45.424017,-75.648259,253
__3ZA9I7,BELLWOOD AVE btwn BELMONT AVE & SUNNYSIDE AVE (__3ZA9I7),2022,85,368999.4341,5028638.488,45.394742,-75.680039,254
__8IAYIU,TERRY FOX DR btwn HUNTSVILLE DR & OLD SECOND LINE RD (__8IAYIU),2022,12279,347872.377,5021267.622,45.330036,-75.950502,255
__51NOTD,TERRY FOX DR btwn RICHARDSON SIDE RD & TILLSONBURG ST (__51NOTD),2022,14221,348945.8188,5019411.451,45.313267,-75.936974,256
e___2JH1,LIVERY ST btwn BALIKUN HTS & GINSENG TERR (e___2JH1),2022,659,352620.3039,5014913.168,45.272549,-75.890547,257
e___2J44,ACONITUM WAY btwn BARRETT FARM DR & LAVATERA ST (e___2J44),2022,261,,,,,258
__3ZA5JH,RENSHAW AVE btwn KEARNSLEY WAY & STONEPATH CRES (__3ZA5JH),2022,1124,348834.3288,5013567.294,45.260686,-75.938915,259
__3ZAC9H,DONALD B. MUNRO DR btwn DIAMONDVIEW RD & VAUGHAN SIDE RD (__3ZAC9H),2022,1217,337699.5093,5021773.768,45.335141,-76.080246,260
__3ZACD8,DONALD B. MUNRO DR btwn JOHN SHAW RD & WILLIAM HODGINS LANE (__3ZACD8),2022,849,335801.3469,5022703.707,45.343595,-76.104405,261
__7JQ7ID,SPRUCE RIDGE RD btwn HAZELDEAN RD & RICHARDSON SIDE RD (__7JQ7ID),2022,800,344209.0047,5013237.762,45.257995,-75.997874,262
__3ZBPNH,CHARTWELL AVE btwn CRAIGMOHR CRT & MIDPARK WAY (__3ZBPNH),2022,408,362315.2814,5021711.666,45.332996,-75.766208,263
__4WKBR1,LLOYDALEX CRES btwn ECHO POND WAY & ECHOWOODS AVE (__4WKBR1),2022,569,348567.4963,5014751.31,45.271357,-75.94221,264
__3ZACQT,NEIL AVE btwn CARP RD & MCCOOEYE LANE (__3ZACQT),2022,253,349142.9725,5014444.425,45.268559,-75.934904,265
__4TYA7Z,FRIENDLY CRES (__4TYA7Z),2022,118,351835.3334,5012495.697,45.250849,-75.900779,266
__3ZA6F7,VINEYARD DR btwn BEAUJOLAIS CRES & BURGUNDY LANE (__3ZA6F7),2022,877,378771.6601,5036971.477,45.468753,-75.553991,267
__3ZA88E,PLEASANT PARK RD btwn DELMAR DR & DORVAL AVE (__3ZA88E),2022,3481,372000.4275,5028557.421,45.393731,-75.641725,268
__3ZA372,RIVERSIDE DR btwn HOG'S BACK RD & RIDGEWOOD AVE (__3ZA372),2022,25796,368218.2394,5025915.144,45.370309,-75.690365,269
__3ZA71F,MANOTICK STATION RD btwn HERBERTS CORNERS RD & SNAKE ISLAND RD (__3ZA71F),2022,1514,376365.6485,5006653.405,45.196215,-75.589141,270
__3ZA9QM,FEATHERSTON DR btwn WYNDALE CRES & WYNDALE CRES (__3ZA9QM),2022,1688,371615.0767,5027351.133,45.382914,-75.64681,271
__3ZA2KT,MCMASTER AVE btwn ASTER ST & VIRGINIA DR (__3ZA2KT),2022,187,371659.1988,5027813.585,45.387071,-75.646184,272
__3ZA9YO,BROOKFIELD RD btwn CLEMENTINE BLVD & FALCON AVE (__3ZA9YO),2022,805,369611.7189,5026382.032,45.374383,-75.672516,273
__3ZA9XG,KALADAR AVE btwn DARTMOUTH AVE & TRAVERSE DR (__3ZA9XG),2022,510,369755.3668,5026208.981,45.372813,-75.670705,274
__3ZBOFO,HERON RD btwn BAYCREST DR & FINN CRT (__3ZBOFO),2022,20216,370987.6011,5026962.356,45.379476,-75.654873,275
__3ZA0SL,KITCHENER AVE btwn COCHRANE ST & JASPER AVE (__3ZA0SL),2022,2334,370979.9222,5025760.451,45.368662,-75.655132,276
__3ZA9YH,HEATHERINGTON RD btwn ALBION RD N & BANNERHILL PRIV (__3ZA9YH),2022,2529,371476.1056,5026261.217,45.373121,-75.648731,277
__3ZA9QQ,RANDALL AVE btwn RALSTON ST & RIDGECREST PL (__3ZA9QQ),2022,892,370213.0218,5027341.87,45.382963,-75.664712,278
__3ZA0SC,NOTTING HILL AVE btwn HAMPSTEAD PL & VANCOUVER AVE (__3ZA0SC),2022,187,370843.2249,5025997.529,45.370808,-75.656846,279
__3ZA3JH,MACFARLANE RD btwn GREENSIDE AVE & O'DONNELL CRT (__3ZA3JH),2022,3549,367114.7096,5021365.492,45.329472,-75.705025,280
__3ZA3IW,MACFARLANE RD btwn BRISBANE RD & PINEGLEN CRES (__3ZA3IW),2022,3511,366669.3955,5021082.664,45.326966,-75.710741,281
__3ZA1VC,PIKE ST btwn CASTLEGREEN PRIV & HUNTERSFIELD DR (__3ZA1VC),2022,1921,373197.237,5025259.522,45.363942,-75.626898,282
__67PTNB,FINDLAY CREEK DR btwn BRADWELL WAY & GOLDEN SEDGE WAY (__67PTNB),2022,5503,374897.4292,5019861.661,45.315206,-75.605962,283
__3ZA08A,HIGHLAND AVE btwn BYRON AVE & KENWOOD AVE (__3ZA08A),2022,282,362800.4683,5027782.622,45.387582,-75.759306,284
__3ZA083,BROADVIEW AVE btwn BYRON AVE & KENWOOD AVE (__3ZA083),2022,1535,362734.7855,5027735.916,45.387167,-75.76015,285
__3ZA08J,DENBURY AVE btwn BYRON AVE & KENWOOD AVE (__3ZA08J),2022,384,362599.0995,5027635.241,45.386273,-75.761895,286
__3ZA07J,FRASER AVE btwn BYRON AVE & CROSSFIELD AVE (__3ZA07J),2022,744,362554.991,5027528.349,45.385314,-75.762471,287
__3ZAA3J,HEMMINGWOOD WAY btwn DRAFFIN CRT & NORTHGATE ST (__3ZAA3J),2022,1793,362039.1836,5023089.004,45.345412,-75.769571,288
__3ZA25N,WOODROFFE AVE btwn HWY417 IC127 RAMP35 & HWY417 IC127 RAMP63 (__3ZA25N),2022,25819,362131.1576,5024822.048,45.360998,-75.768197,289
e___2J6X,DUN SKIPPER DR btwn KELLY FARM DR & PINGWI PL (e___2J6X),2022,1669,,,,,290
__3ZABC2,LIARD ST btwn JOHN SIDNEY CRES N & SUNRAY CRES (__3ZABC2),2022,691,351358.4314,5012939.706,45.254876,-75.906813,291
__3ZACN9,LIARD ST btwn BASSWOOD AVE & STITTSVILLE MAIN ST (__3ZACN9),2022,662,350972.875,5012849.248,45.254088,-75.911733,292
__3ZA3SF,LEITRIM RD btwn BANK ST & FENTON RD (__3ZA3SF),2022,11463,374653.3685,5021143.95,45.326768,-75.608894,293
__8PNKGU,ROTARY WAY btwn FERNSIDE ST & SUNBURST ST (__8PNKGU),2022,1184,,,,,294
__3ZA9XV,TAPIOLA CRES btwn TAMMELA CRT & WHITE CLOVER PRIV (__3ZA9XV),2022,1374,372086.7321,5025234.522,45.363825,-75.641076,295
__3ZA3CM,LEES AVE btwn HWY417 IC118 RAMP45 & TRANSIT (__3ZA3CM),2022,7809,369621.2132,5030929.57,45.415299,-75.671797,296
__3ZA945,LYON ST    S btwn POWELL AVE & RENFREW AVE (__3ZA945),2022,970,367905.4281,5029827.712,45.405542,-75.693858,297
__3ZA056,CLEARVIEW AVE btwn ISLAND PARK DR & REMIC AVE (__3ZA056),2022,1689,363549.1133,5029317.931,45.401334,-75.749564,298
__3ZA4Z2,CARLING AVE btwn BAYFIELD AVE & BURKE RD (__3ZA4Z2),2022,9007,352593.229,5022509.097,45.340901,-75.890159,299
__3ZA4Z6A,CARLING AVE btwn BURKE RD & DEFENSE  RESEARCH COMPLEX (__3ZA4Z6A),2022,8902,353093.5817,5022820.363,45.343668,-75.883745,300
__3ZA933,GLEBE AVE btwn BANK ST & LYON ST S (__3ZA933),2022,1427,368124.6638,5029719.466,45.404548,-75.691072,301
__3ZA10N,BURMA RD btwn DRAYTON PRIV & PROVENDER AVE (__3ZA10N),2022,1586,373185.217,5034723.596,45.449097,-75.625739,302
__3ZA4GE,CRICHTON ST btwn ELECTRIC ST & THE MEWS LANE (__3ZA4GE),2022,3512,368848.1256,5033586.151,45.439273,-75.681328,303
__3ZBON0,HINTON AVE   S btwn KENILWORTH ST & SHERWOOD DR (__3ZBON0),2022,160,365260.6985,5028605.553,45.394779,-75.72779,304
__3ZA097,BUELL ST btwn HILSON AVE & PARKVIEW RD (__3ZA097),2022,417,364251.6946,5027908.047,45.388589,-75.74076,305
__3ZA8RV,LONDON TER btwn GEORGETON PRIV & HEMLOCK RD (__3ZA8RV),2022,1067,371234.8762,5034910.606,45.450967,-75.650645,306
__3ZA0JH,WESLEY AVE btwn BEVAN AVE & TWEEDSMUIR AVE (__3ZA0JH),2022,562,363706.2591,5028267.407,45.391869,-75.747682,307
__3ZAA7C,BREN-MAUR RD btwn EISENHOWER CRES & NEWLAND DR (__3ZAA7C),2022,474,366092.198,5014369.431,45.266612,-75.718934,308
e___2MQM,POPLIN ST btwn SPRATT RD & STOCKHOLM PRIV (e___2MQM),2022,1068,368399.3485,5014870.399,45.270914,-75.689472,309
__4YT1LV,WILBERT COX DR (__4YT1LV),2022,85,344253.6083,5015968.987,45.282569,-75.997089,310
__3ZBN8V,RENAUD RD btwn NAVAN RD & WHITE ST (__3ZBN8V),2022,3996,382304.4584,5033035.488,45.432957,-75.509438,311
__3ZA6ED,RICHER DR btwn LEGAULT ST & NOTRE DAME ST (__3ZA6ED),2022,266,380806.4807,5036780.152,45.466813,-75.528002,312
__3ZA4GQ,BASKINS BEACH RD btwn END & WREN ST (__3ZA4GQ),2022,170,343342.7848,5037813.407,45.479182,-76.006993,313
__3ZAC23,BASKINS BEACH RD btwn WREN ST & WREN ST (__3ZAC23),2022,182,343841.6213,5037638.155,45.477578,-76.000627,314
__3ZABTI,MCCLELLAN RD btwn PAULA CRES & PAULA CRES (__3ZABTI),2022,1310,360186.6721,5021380.488,45.330187,-75.7934,315
__3ZA2O3,BAYFIELD AVE btwn CARLING AVE & HERZBERG RD (__3ZA2O3),2022,362,352227.6757,5022268.765,45.338763,-75.894847,316
__3ZA7H2,MEADOW DR (__3ZA7H2),2022,126,378902.2036,5014004.272,45.262093,-75.555766,317
e___2KNQ,DECOEUR DR btwn AQUARIUM AVE/GUPPY GROVE & SCULPIN ST (e___2KNQ),2022,2895,,,,,318
__4CZONJ,FINN CRT btwn COLBERT CRES & COLBERT CRES (__4CZONJ),2022,416,370850.7289,5026778.161,45.377831,-75.656645,319
__3ZAARH,SUNNYCREST DR btwn MARSON ST & WILLETH AVE (__3ZAARH),2022,480,365856.2025,5025723.528,45.368795,-75.720541,320
__3ZBOD0,KIRKWOOD AVE btwn LAPERRIERE AVE & WOODWARD AVE (__3ZBOD0),2022,10201,364552.4255,5026929.718,45.379761,-75.737038,321
__3ZA3AI,KIRKWOOD AVE btwn COLDREY AVE & LAPERRIERE AVE (__3ZA3AI),2022,10244,364477.669,5027046.732,45.38082,-75.737978,322
__45KTKE,PARKIN CIRC btwn MAASS GT & STEDMAN ST (__45KTKE),2022,189,372560.5933,5022927.185,45.343018,-75.635344,323
__3ZAZAI,PETER MORAND CRES btwn END & ROGER GUINDON AVE (__3ZAZAI),2022,381,371863.911,5029654.014,45.403611,-75.643319,324
__3ZA2WC,BURNT LANDS RD btwn MARCH RD & VAUGHAN SIDE RD (__3ZA2WC),2022,210,332012.1203,5014658.101,45.271354,-76.153198,325
__3ZA6WJ,MARIONVILLE RD btwn 8TH LINE RD & 9TH LINE RD (__3ZA6WJ),2022,489,390138.0758,5002394.749,45.156366,-75.414608,326
__3ZA8L8,BORTOLOTTI CRES btwn BRADSHAW CRES & BRADSHAW CRES (__3ZA8L8),2022,182,374519.4906,5031772.476,45.422412,-75.609101,327
e___1G0P,WARMSTONE DR btwn CENTO WAY & ROSEHILL AVE (e___1G0P),2022,585,350163.4043,5016274.002,45.284957,-75.921733,328
__3ZAA60,MAPLEHILL WAY btwn HAZELWOOD WAY & PRINCE OF WALES DR (__3ZAA60),2022,102,366868.2346,5012560.109,45.250263,-75.709271,329
__3ZA3FF,DUNROBIN RD btwn CONSTANCE BAY RD & KINBURN SIDE RD (__3ZA3FF),2022,6073,337425.0672,5036577.193,45.46836,-76.082768,330
__3ZBOWZ,MARIER AVE btwn CARILLON ST & DESCHAMPS AVE (__3ZBOWZ),2022,4355,370352.2101,5033378.591,45.437266,-75.662132,331
__3ZBOWW,MARIER AVE btwn ETHEL ST & MONTFORT ST (__3ZBOWW),2022,3926,370279.2096,5033507.593,45.438434,-75.663048,332
__5A7MC7,AQUAVIEW DR btwn BEAUCACHE PRIV & LOUIS TOSCANO DR (__5A7MC7),2022,969,384684.1736,5035297.161,45.453037,-75.478661,333
__5Z1T0B,WORTHAM WAY btwn CLARINGTON AVE & SARABELLA ST (__5Z1T0B),2022,86,385144.3995,5035158.402,45.451736,-75.4728,334
__6REWP9,RYWALK CIRC (__6REWP9),2022,109,372347.3718,5024547.539,45.357618,-75.637843,335
__3ZA7LC,CENTREPARK DR btwn BEARBROOK RD & SILVER ASPEN CRES (__3ZA7LC),2022,141,377759.6049,5033026.672,45.433366,-75.567517,336
__3ZA035,BEECH ST btwn BAYSWATER AVE & BREEZEHILL AVE S (__3ZA035),2022,881,366234.2019,5029078.057,45.398945,-75.715298,337
__3ZA31L,ROCHESTER ST btwn GLADSTONE AVE & HWY417 IC121B RAMP16 (__3ZA31L),2022,10283,366700.203,5029703.062,45.404528,-75.709268,338
__3ZA6KF,CLEROUX CRES btwn INNES RD & ORIENT PARK DR (__3ZA6KF),2022,382,379094.8516,5033401.207,45.436596,-75.550398,339
__3ZBPIW,ST. PIERRE ST btwn ROCQUE ST & ST. JOSEPH BLVD (__3ZBPIW),2022,407,381297.2208,5037624.081,45.474352,-75.521595,340
__3ZA2G9,COLONIAL RD btwn DELSON DR & FRANK KENNY RD (__3ZA2G9),2022,4628,389767.7022,5031976.614,45.422563,-75.414251,341
__3ZA04M,BAYSWATER AVE btwn FERN AVE & OAKVALE AVE (__3ZA04M),2022,1989,366140.7015,5029159.558,45.399687,-75.716482,342
__3ZAAIA,BREEZEHILL AVE   N btwn LAUREL ST & SOMERSET ST W (__3ZAAIA),2022,815,365959.2985,5029843.475,45.405856,-75.718715,343
__3ZA31S,GLADSTONE AVE btwn PRESTON ST & ROCHESTER ST (__3ZA31S),2022,7259,366576.8345,5029749.948,45.404961,-75.710838,344
__86L61O,SUMMERHILL ST btwn GOLDEN SPRINGS CRES E & MATTINGLY WAY/GOLDEN SPRINGS CRES (__86L61O),2022,980,367931.2744,5014405.507,45.266774,-75.695495,345
__3ZA3H3,MITCH OWENS RD btwn LIMEBANK RD & SPRATT RD (__3ZA3H3),2022,11595,370814.979,5011576.179,45.241051,-75.659127,346
__3ZA7HW,PARKWAY RD btwn GOOD ST & KESWICK DR (__3ZA7HW),2022,2887,378237.7655,5013897.942,45.261206,-75.564247,347
__86L61E,BRIAN GOOD AVE btwn HAWKESWOOD DR & SUMMERHILL ST (__86L61E),2022,1504,368171.77,5014459.675,45.267239,-75.692424,348
__3ZACCH,CORKERY RD btwn MANION RD & MARCH RD (__3ZACCH),2022,348,337340.1174,5014773.616,45.272167,-76.08529,349
e___2HJX,DES SOLDATS-RIENDEAU ST btwn LAMPREY ST & RIVER MIST RD (e___2HJX),2022,524,364794.5187,5011697.509,45.242682,-75.735791,350
__3EX1Y6,GOLDENEYE WAY btwn ANTIQUE CRT & ROCKY HARBOUR CRES (__3EX1Y6),2022,802,368843.3941,5016038.615,45.281386,-75.683662,351
__3ZA5P6,LONG ISLAND RD btwn CINDY HILL CRES & WATERPARK PL (__3ZA5P6),2022,1141,368285.4205,5011176.973,45.237692,-75.691395,352
__3ZA39Q,BRIDGE ST btwn ARTHUR CRES & WEST RIVER DR (__3ZA39Q),2022,14129,368999.9232,5010246.39,45.229253,-75.682416,353
__6KE629,MOODIE DR btwn ARNOLD DR & SONGBIRD PRIV (__6KE629),2022,2826,357576.0963,5019256.403,45.311276,-75.826929,354
__3ZA5CB,AMIENS ST btwn BLACKHEATH ST & DUFORD DR (__3ZA5CB),2022,2296,382378.1324,5037347.089,45.471741,-75.507816,355
__3ZAZVG,LONGLEAF DR btwn APPLE LEAF WAY & ORLEANS BLVD (__3ZAZVG),2022,666,380775.4968,5033551.703,45.437769,-75.528896,356
__3ZA6E0,CARRIERE ST btwn MICHAELSEM ST & ORLEANS BLVD (__3ZA6E0),2022,1048,381072.5434,5036691.589,45.465987,-75.524613,357
__3ZA6DT,BEAUSEJOUR DR btwn BARRINGTON ST & ORLEANS BLVD (__3ZA6DT),2022,3513,381158.7888,5035925.821,45.459088,-75.523629,358
__3ZA6WY,PRESTWICK DR btwn GALLOWAY DR & PAYETTE DR (__3ZA6WY),2022,1915,383193.1777,5037008.439,45.468603,-75.497448,359
e___2ICA,DES AUBEPINES DR btwn DECOEUR DR & HYSSOP ST/YELLOWCRESS WAY (e___2ICA),2022,1766,384140.7908,5034625.982,45.447061,-75.485715,360
e___2HVN,DECOEUR DR btwn DES AUBEPINES DR & MAGNOLIA ST (e___2HVN),2022,2648,384307.6665,5034628.78,45.447067,-75.483582,361
e___2HP3,FERN CASEY ST btwn AXIS WAY & LOCUST RIDGE (e___2HP3),2022,3525,382464.6074,5033601.874,45.438035,-75.507302,362
__3ZA6QZ,SUNVIEW DR btwn DES EPINETTES AVE & DES PERDRIX CRES (__3ZA6QZ),2022,1863,382128.4822,5036050.077,45.460099,-75.511213,363
__3ZA6XD,DUFORD DR btwn CHARTRAND AVE & FRASER PK (__3ZA6XD),2022,2085,382101.5046,5037437.675,45.472586,-75.511339,364
__3ZAAVF,WITHROW AVE btwn BASSANO ST & PENDER ST (__3ZAAVF),2022,496,364223.3596,5023965.538,45.353117,-75.741596,365
__3ZA9WR,TRAPPER'S RD btwn ALDERWOOD ST & FARRIERS LANE (__3ZA9WR),2022,923,371918.5026,5023272.787,45.34619,-75.643489,366
__4O3KAZ,OWLS CABIN AVE btwn CANYON WALK DR & FEATHER MOSS WAY (__4O3KAZ),2022,207,369022.6736,5016668.313,45.287035,-75.681296,367
__4QVZS3,CLARIDGE DR btwn CLENNING ST & UPNEY DR (__4QVZS3),2022,2193,364965.1706,5016469.845,45.285608,-75.73304,368
__3ZBN85,ST. GEORGES ST btwn GALLOWAY DR & GLENEAGLES AVE (__3ZBN85),2022,1974,382805.4472,5037050.661,45.469026,-75.502399,369
__3ZAB12,PALOMINO DR btwn CHICKASAW CRES S & ROTHESAY DR (__3ZAB12),2022,1188,354250.8861,5017334.895,45.294228,-75.869525,370
__3ZA3V2,KING EDWARD AVE btwn DALY AVE & STEWART ST (__3ZA3V2),2022,13596,368613.206,5032239.584,45.427179,-75.684505,371
__3ZAALG,ALBANY DR btwn EMERALD AVE & HANBURY ST (__3ZAALG),2022,339,363216.786,5024648.547,45.359348,-75.754361,372
__3ZAACU,WOODLAND AVE btwn BYRON AVE & MIDWAY AVE (__3ZAACU),2022,149,361396.6819,5026151.531,45.373021,-75.777419,373
__3ZA0LI,LONG ISLAND RD btwn RIVERSIDE CRES & SUNRISE AVE (__3ZA0LI),2022,1582,368665.1527,5010649.641,45.232912,-75.686627,374
__3ZA705,EASTVALE DR btwn LOYOLA AVE & OGILVIE RD (__3ZA705),2022,3193,375573.7374,5035069.361,45.45197,-75.595157,375
__3ZA8P3,ROSEBELLA AVE btwn CONROY RD & EIGHTH ST (__3ZA8P3),2022,1413,374060.243,5024055.513,45.353024,-75.616052,376
__3ZACOP,CARLETON CATHCART ST btwn BRADLEY ST & RALPHPARK ST (__3ZACOP),2022,473,350868.5896,5013061.418,45.256004,-75.913042,377
__3ZA9MT,MONK ST btwn ERNIE BRADY LANE & WOODLAWN AVE (__3ZA9MT),2022,1397,368468.3821,5029067.259,45.398649,-75.686765,378
__3ZA7XS,CROWNHILL ST btwn SEGUIN ST & SUMAC ST (__3ZA7XS),2022,786,374505.4924,5034205.87,45.444308,-75.608935,379
e___2KKW,VIVERA PL btwn CLIO ST & MERRILLL ST (e___2KKW),2022,154,,,,,380
__3ZABDO,PICKFORD DR btwn KOFFMAN CRT & SHATNER GT (__3ZABDO),2022,1008,353379.4026,5018767.074,45.307176,-75.880495,381
__3ZA3A3,BEECHWOOD AVE btwn GREEN AVE & MARQUETTE AVE (__3ZA3A3),2022,10866,369676.206,5034026.099,45.443155,-75.670687,382
__3ZA8ON,BADEN AVE btwn AUTUMNWOOD ST & AUTUMNWOOD ST (__3ZA8ON),2022,191,372323.8773,5022705.258,45.341044,-75.638394,383
__3ZAZNO,MARSHWOOD RD btwn DEERTAIL LANE & VAUGHAN SIDE RD (__3ZAZNO),2022,84,332947.1182,5019731.43,45.31697,-76.140995,384
__3ZA4XL,CARBERY DR (__3ZA4XL),2022,361,350607.0901,5013786.924,45.262549,-75.916307,385
__3ZBNG1,BRITANNIA RD btwn CONN ST & PRISCILLA ST (__3ZBNG1),2022,1207,360059.6746,5025005.52,45.362815,-75.794615,386
__3ZA9KT,SUNNYSIDE AVE btwn BELLWOOD AVE & RIVERDALE AVE (__3ZA9KT),2022,3878,369036.2571,5028759.2,45.395825,-75.679553,387
__3ZBOYM,NORTH RIVER RD btwn GLYNN AVE & OLGA ST (__3ZBOYM),2022,2148,370039.2121,5032027.579,45.42514,-75.666312,388
__3ZA16W,KELLY AVE btwn MONCTON RD & NEVILLE ST (__3ZA16W),2022,1022,360433.6757,5024018.081,45.353901,-75.789953,389
__3ZA0EM,KERR AVE btwn BOYD AVE & NADOLNY SACHS PRIV (__3ZA0EM),2022,2012,363377.2754,5026601.344,45.376905,-75.752081,390
__3ZAA6N,KERR AVE btwn DENISON CRES & REX AVE (__3ZAA6N),2022,451,363111.1901,5026480.034,45.375836,-75.755492,391
__3ZABSG,CONOVER ST btwn CHARING RD & ELVASTON AVE (__3ZABSG),2022,950,361840.9614,5021417.04,45.330384,-75.772293,392
__3ZA6HI,SARSFIELD RD btwn COLONIAL RD & LARMOURS RD (__3ZA6HI),2022,268,395345.2105,5033852.698,45.438742,-75.342649,393
__3ZABUR,NEVILLE ST btwn CLARENDA ST & KELLY AVE (__3ZABUR),2022,915,360479.6736,5024124.184,45.354852,-75.789354,394
__4FP8A8,CHAPMAN MILLS DR btwn SUMMERLINE GT & WOODROFFE AVE (__4FP8A8),2022,2842,366113.8515,5015185.772,45.273955,-75.718557,395
__3ZA8EX,PEACH TREE LANE btwn KAREN WAY & MEADOW PARK PL (__3ZA8EX),2022,87,371303.4543,5034578.902,45.447976,-75.649813,396
__6XF94A,COLONNADE RD    N btwn COLONNADE RD & CORINTH PRIV (__6XF94A),2022,5329,366248.4052,5023046.531,45.344674,-75.715867,397
__3ZAA5Y,CALDWELL AVE btwn MEDFORD ST & MORISSET AVE (__3ZAA5Y),2022,2407,364520.9054,5026087.657,45.372187,-75.737542,398
__3ZAZTU,SPRATT RD btwn CANYON WALK DR & SHORELINE DR (__3ZAZTU),2022,5608,368571.1992,5015860.855,45.279811,-75.687154,399
__3ZA9MB,MONK ST btwn HOLMWOOD AVE & TACKABERRY LANE (__3ZA9MB),2022,1619,368435.6981,5029144.66,45.399348,-75.687173,400
__3ZBOWM,ST. CHARLES ST btwn BARRETTE ST & LAVAL ST (__3ZBOWM),2022,411,369498.206,5033703.596,45.44027,-75.673004,401
__3ZA9L7,SOUTHERN DR btwn BRISTOL AVE & RIVERDALE AVE (__3ZA9L7),2022,285,369148.3168,5028919.889,45.39726,-75.678101,402
__3ZBO4F,CHARBONNEAU ST btwn SCHOUTEN DR & SCHOUTEN DR (__3ZBO4F),2022,65,382821.1557,5036666.308,45.465566,-75.502259,403
__3ZAAOA,MILLBROOK CRES btwn DEER PARK RD & GREENWICH AVE (__3ZAAOA),2022,148,366057.2898,5025214.315,45.364196,-75.718037,404
__3ZAAOE,MILLBROOK CRES btwn DEER PARK RD & HILLIARD AVE (__3ZAAOE),2022,651,366015.1027,5025285.565,45.364841,-75.718567,405
__3ZA6RD,DES EPINETTES AVE btwn COTTONWOOD CRES & LAFRANCE DR (__3ZA6RD),2022,4722,383250.2559,5036581.569,45.464756,-75.496786,406
__30XHQS,BLUE WILLOW CRES btwn DES GRANDS CHAMPS & LONGWATER ST (__30XHQS),2022,715,380785.9438,5033271.029,45.435243,-75.528806,407
__3ZAAPS,HILLIARD AVE btwn MILLBROOK CRES & VANSON AVE (__3ZAAPS),2022,272,366174.3037,5025434.121,45.366163,-75.716516,408
__3ZAAQY,HILLIARD AVE btwn OAKWOOD AVE & VANSON AVE (__3ZAAQY),2022,480,366240.2045,5025621.027,45.367839,-75.715652,409
__3ZAAO6,HILLIARD AVE btwn BARLYN AVE & LYALL ST (__3ZAAO6),2022,355,365860.2976,5025221.713,45.364279,-75.720551,410
__3ZA1D3,BELLA VISTA DR btwn MEADOW LANE RD & TED KELLY LANE (__3ZA1D3),2022,101,386052.9764,5041899.99,45.512285,-75.460071,411
__3ZABWO,GREENVIEW AVE btwn CARLING AVE & DON ST (__3ZABWO),2022,744,359955.5199,5024843.878,45.361369,-75.795963,412
__3ZA8JV,QUEEN MARY ST btwn MARION AVE & VANIER PKWY (__3ZA8JV),2022,2023,370285.42,5031948.833,45.424408,-75.663176,413
__3ZA78Y,SAUNDERSON DR btwn HAIG DR & RAGLAN AVE (__3ZA78Y),2022,883,372655.505,5029473.352,45.401909,-75.633234,414
__3ZA781,CUBA AVE btwn HUTTON AVE & RUSSELL RD (__3ZA781),2022,698,372995.6542,5029461.906,45.401773,-75.628891,415
__3ZA3K2,SAUMURE RD btwn DEVINE RD & INDIAN CREEK RD (__3ZA3K2),2022,1864,401542.4135,5025932.035,45.366654,-75.265008,416
__3ZA87M,ORLANDO AVE btwn DENVER AVE & GIBSON ST (__3ZA87M),2022,165,370624.6082,5027152.593,45.381222,-75.659482,417
__3ZA4FZ,NORTH RIVER RD btwn PRINCE ALBERT ST & PRINDIVILLE ST (__3ZA4FZ),2022,962,370089.8255,5031883.169,45.423836,-75.665684,418
__3ZAC46,DAVID MANCHESTER RD btwn MCGEE SIDE RD & NORTHSHIRE DR (__3ZAC46),2022,95,342587.4574,5017121.99,45.293036,-76.018239,419
__3ZA5V7,DAVID MANCHESTER RD btwn FALCON BROOK RD & RICHARDSON SIDE RD (__3ZA5V7),2022,439,343957.6893,5015578.697,45.279074,-76.000892,420
__8PNLQZ,CARINA CRES btwn LOCHNAW PRIV & SHANLY PRIV (__8PNLQZ),2022,341,364810.6211,5013008.834,45.254479,-75.735428,421
__6OE77W,CEDAR CREEK DR (__6OE77W),2022,1611,375718.3955,5020098.278,45.317253,-75.595459,422
__8176PK,MANCINI WAY btwn INFUSION PRIV E & INFUSION PRIV W (__8176PK),2022,298,364934.4291,5014732.392,45.269977,-75.733642,423
__3ZA05M,EDGAR ST btwn FAIRMONT AVE & IRVING AVE (__3ZA05M),2022,139,365824.8622,5029253.248,45.400557,-75.720505,424
__3ZA6PC,LEGRAND CRES btwn WENDLER TER & WILDFLOWER DR (2) (__3ZA6PC),2022,179,382671.6401,5035833.804,45.458093,-75.504303,425
__74S5VG,COBBLE HILL DR btwn POPPLEWELL CRES & POPPLEWELL CRES (__74S5VG),2022,1013,361304.1043,5014791.397,45.270809,-75.779897,426
__42HLTD,LUESBY CRES btwn VALIN ST & WINSOME TER (__42HLTD),2022,217,386089.6995,5037452.277,45.472265,-75.460337,427
