__3Z0GOW,HARROLD PL S/W LEG btwn HARROLD PL WEST LOOP & VETERAN AVE S (__3Z0GOW),2023,63,365089.023,5027606.5656,45.3858047270463,-75.7301043304848,359
__3Z0FO9,UPLANDS DR btwn PAUL ANKA DR & SHEARWATER PRIV (__3Z0FO9),2023,2798,369580.012017221,5023451.28204743,45.3480087248712,-75.673295943104,360
__3Z086V,KING EDWARD AVE btwn BOLTON ST & CATHCART ST (__3Z086V),2023,30808,368063.9211,5033135.123,45.4352865475347,-75.6914088281508,361
__3Z09W6,KIRKWOOD AVE btwn LAPERRIERE AVE & WOODWARD AVE (__3Z09W6),2023,10060,364553.295114471,5026929.98586847,45.3797596480771,-75.7370208799899,362
__3ZAJTX,MCCURDY DR btwn THIESSEN CRES & NAISMITH CRES (__3ZAJTX),2023,1402,351834.204733604,5018393.80469543,45.3039196447778,-75.9002472303435,363
__3Z085E,MONTREAL RD btwn MONTGOMERY ST & PALACE ST (__3Z085E),2023,10552,369885.102458553,5032958.75037042,45.4335328212844,-75.6681567382662,364
__3Z0DS3,PITTAWAY AVE btwn NOTMAN WAY & BLOHM DR (__3Z0DS3),2023,194,374184.701416552,5026074.99215165,45.3712063632368,-75.6141995538861,365
__3Z0AVG,CRAIG HENRY DR btwn WOODVALE GR & KNOXDALE RD (__3Z0AVG),2023,5246,363076.426541503,5021728.98551227,45.3330894605093,-75.7564963367091,366
__3ZAH65,NANAIMO DR btwn MOHAWK CRES & MOHAWK CRES (__3ZAH65),2023,2180,359366.16845,5022668.4989,45.3418412853141,-75.8037252161102,367
__3Z0AKR,GARDENWAY DR btwn LATOUR CRES & OAKLAWN CRES (__3Z0AKR),2023,2500,384063.75945,5036728.56545,45.465986569853,-75.4863610180418,368
__3Z0EEI,SECOND AVE btwn LYON ST & BANK ST (__3Z0EEI),2023,1036,368202.004382889,5029564.48492736,45.4031459613951,-75.6901052818746,369
__3Z0BYE,FOREST VALLEY DR btwn DES RAVINS PL & DES RAVINS PL (__3Z0BYE),2023,4321,380010.55380932,5035104.95539746,45.4518640127531,-75.5385034099105,370
__3Z0B3R,8TH LINE RD btwn LLOYD GRAHAM AVE & BYRON ST (__3Z0B3R),2023,3466,385504.8,5011030.4155,45.2346097630753,-75.4721296823034,371
__3ZAH4K,HARRISON ST btwn BARNES CRES & DAYTON CRES (__3ZAH4K),2023,935,360631.1751,5022147.99455,45.3370582545105,-75.7876434677281,372
__3Z0A6L,KEEFER ST btwn STANLEY AVE & RIVER LANE (__3Z0A6L),2023,212,368432.7019,5033644.597,45.4398371419239,-75.6866299671999,373
__3ZAI0V,CASTLEFRANK RD btwn TERRY FOX DR & CASTLE GLEN CRES (__3ZAI0V),2023,4167,353038.31589922,5016339.02795681,45.2853596073154,-75.8850521937982,374
__3Z00A0,KNUDSON DR btwn SHAUGHNESSY CRES & GOULDING CRES (__3Z00A0),2023,3485,350712.176699631,5020560.17244884,45.3234880626995,-75.9143423704693,375
__5RGO52,DOZOIS RD btwn MITCH OWENS RD & LONGSHADOW ST (__5RGO52),2023,3050,371694.117068114,5012062.03332089,45.245339602434,-75.6478646423681,376
__3ZAHNW,NANAIMO DR btwn ALEUTIAN RD & MOHAWK CRES (__3ZAHNW),2023,2497,359243.561926122,5022673.13254652,45.3418894898512,-75.8052782158183,377
__3Z0CJ3,ST. LOUIS DR btwn HIAWATHA PARK RD & BUCKSKIN WAY (__3Z0CJ3),2023,1793,379463.719242339,5038345.60156246,45.4810418048671,-75.5449238569653,378
__3ZAJBM,NANTES ST btwn BEROT LANE & IVANY WAY (__3ZAJBM),2023,1171,386037.719698705,5035857.80582326,45.457927694571,-75.4612668244194,379
__3Z0G83,AMESBROOKE DR btwn FORLAN DR & MAITLAND AVE (__3Z0G83),2023,270,363746.819276624,5025057.46160134,45.3629784595169,-75.7475473035867,380
__3ZAJ2Y,ALLBIRCH RD btwn SHADY LANE & BISHOP DAVIS DR (__3ZAJ2Y),2023,1380,337292.335224455,5038897.27999957,45.4892578041962,-76.0843326216279,381
__3ZAH34,ASHGROVE CRES btwn WESTFIELD CRES & LINDHURST CRES (__3ZAH34),2023,1448,361159.6781,5021992.99345,45.335621302904,-75.7809184142448,382
__4O3JPY,BERRIGAN DR btwn CROXLEY WAY & CLARIDGE DR (__4O3JPY),2023,4679,364537.7085,5015780.7689,45.2794445888417,-75.7385712993878,383
__3Z0A5O,MOUNTSHANNON DR btwn EARL MULLIGAN DR & WOODFORD WAY (__3Z0A5O),2023,1631,364855.484048551,5017152.45865205,45.2917966506878,-75.7343619776063,384
__67PTM1,WHITE ALDER AVE btwn FLAT SEDGE CRES & BUTTONBUSH WAY (__67PTM1),2023,885,375328.5385,5020650.237,45.3222586248838,-75.6003522703991,385
__3Z0DT9,ALBION RD btwn BADEN AVE & ALADDIN LANE (__3Z0DT9),2023,6795,372540.354636302,5022698.5513728,45.3409636035699,-75.635633503938,386
__3Z0F6R,WOODWARD AVE btwn KIRKWOOD AVE & KENZIE ST (__3Z0F6R),2023,318,364605.50945,5026916.51345,45.3796372132856,-75.7363618834073,387
__3ZAHBX,CHURCH ST btwn LENIDA DR & CAROLIN CRT (__3ZAHBX),2023,1292,366386.63837618,4998948.32476328,45.1278287858242,-75.7170845307483,388
__3Z0DOT,QUEEN MARY ST btwn NORTH RIVER RD & MARION AVE (__3Z0DOT),2023,2134,370148.2015,5031933.0781,45.4242793599257,-75.6649314579955,389
__3Z0B09,VOYAGEUR DR btwn FAIRWINDS TERR & EASTPORT DR (__3Z0B09),2023,302,378654.223048644,5038087.25805743,45.4788271798082,-75.5552550355884,390
__3Z0GW0,BLACK FRIARS RD btwn SAVILLE ROW & MANITOU DR (__3Z0GW0),2023,148,362212.216279952,5026548.82614376,45.3765295839328,-75.7669661677153,391
__5J15MX,MAXWELL BRIDGE RD btwn FORDELL AVE & ARNCLIFFE AVE (__5J15MX),2023,291,349540.32945,5024893.75055,45.3625600767645,-75.9288965067759,392
__3Z0G7L,AGINCOURT RD btwn NAVAHO DR & MALLARD AVE (__3Z0G7L),2023,933,363449.52755,5024829.34905,45.360954901363,-75.7513688005714,393
__3Z0944,FISHER AVE btwn NORMANDY CRES & VIEWMOUNT DR (__3Z0944),2023,13893,366895.310253147,5024275.4324763,45.355676622541,-75.7074601161085,394
__3ZAITG,PICKFORD DR btwn STURSBERG WAY & HARMON WAY (__3ZAITG),2023,1364,352808.1189,5018544.9615,45.3052163344124,-75.8878018343056,395
__8IAYQM,MARKETPLACE AVE btwn RIOCAN AVE & SUE HOLLOWAY DR (__8IAYQM),2023,6808,364382.007285065,5014813.58038042,45.2707549541394,-75.7406720461992,396
__3Z0DLG,RANGE RD btwn SOMERSET ST & TEMPLETON ST (__3Z0DLG),2023,2241,369661.71055,5031985.57905,45.424797023087,-75.671140645927,397
__3Z05V3,STRANDHERD DR btwn CLARIDGE DR & BEATRICE DR (__3Z05V3),2023,30366,365241.893043126,5015399.52447266,45.2759577631076,-75.7296688279188,398
__3Z0C6B,TAWNEY RD btwn HEATON AVE & SUSAN ST (__3Z0C6B),2023,815,374038.313957662,5028375.59763671,45.391890035121,-75.6157224205381,399
__3ZAH2E,SAVILLE ROW btwn PRINCE CHARLES RD & BLACK FRIARS RD (__3ZAH2E),2023,2481,362073.6849,5026532.03455,45.3763892646862,-75.7687318600021,400
__3Z0EXL,AVENUE RD btwn GLENVIEW AVE & SOUTHERN DR (__3Z0EXL),2023,156,369414.94095,5029139.49425,45.3992118195894,-75.6746668379269,401
__3Z07L0,KELLY AVE btwn MONCTON RD & NEVILLE ST (__3Z07L0),2023,1039,360433.675671642,5024018.08052633,45.3538943705019,-75.7899750774649,402
__3Z0DOR,HENDERSON AVE btwn LAURIER AVE & OSGOODE ST (__3Z0DOR),2023,846,368864.569729598,5031985.52920855,45.4248712871426,-75.6813272236701,403
__3Z070O,MARCH RD btwn HOWIE RD & JACOB'S GT (__3Z070O),2023,9325,337349.363624232,5017352.55035549,45.2953767532396,-76.0849960418776,404
__3ZAH76,RECTOR AVE btwn STANTON RD & SOUTHWOOD DR (__3ZAH76),2023,332,361047.319593086,5023047.51592142,45.3451174865319,-75.782235391727,405
__3Z0G8W,NAVAHO DR btwn AGINCOURT RD & CANNON CRES (__3Z0G8W),2023,1772,363308.52655,5024933.64395,45.3619051139001,-75.7531560842406,406
__3Z0G9H,NAVAHO DR btwn TARA DR & WOODSIDE DR (__3Z0G9H),2023,1423,363507.68,5025014.81945,45.3626188759785,-75.7506045294635,407
__3Z0FF4,WORKMAN AVE btwn ROYAL AVE & CHURCHILL AVE (__3Z0FF4),2023,844,363031.26955,5028600.3355,45.3949206120474,-75.7562624721865,408
__30KGJ4,KITTIWAKE DR btwn CHANTILLY GT & WILDERNESS WAY (__30KGJ4),2023,1574,348337.157,5014388.58205,45.2681071351732,-75.9451773062973,409
__4BQ6F9,JOHNSTON RD btwn ALLANFORD AVE & ROWALLEN PL (__4BQ6F9),2023,5780,373094.888780206,5025978.49422935,45.3704038101699,-75.6281116835365,410
__3Z0BUR,ST. GEORGES ST btwn WARDEN AVE & ROXDALE AVE (__3Z0BUR),2023,1712,382720.25055,5037257.07645,45.4708928092877,-75.5034556146769,411
__3ZAHZZ,WOODLAND AVE btwn BYRON AVE & MIDWAY AVE (__3ZAHZZ),2023,205,361398.46645,5026150.50175,45.373011130734,-75.7773960630668,412
__3Z0GO7,HARROLD PL N/W LEG btwn VETERAN AVE N & HARROLD PL WEST LOOP (__3Z0GO7),2023,79,365075.6981,5027626.5445,45.38598563993,-75.7302720352838,413
__3Z0FJ2,ARLINGTON AVE btwn KENT ST & BANK ST (__3Z0FJ2),2023,2788,367939.4211,5030300.15095,45.409789671188,-75.6933632768892,414
__3Z0B2Q,8TH LINE RD btwn VAN RENS ST & GLENWOOD DR (__3Z0B2Q),2023,1648,385788.29960483,5010290.2405321,45.2279145828326,-75.4686384466805,415
__4TZOAE,LANARK AVE btwn ELLENDALE CRES & METROPOLE PRIV (__4TZOAE),2023,856,363548.138916065,5029071.04262919,45.3992023772027,-75.7496788124532,416
__3ZAHDV,RIDGEFIELD CRES btwn EVERGREEN DR & LONGWOOD AVE (__3ZAHDV),2023,1431,358018.908301585,5020373.25607472,45.3212898752224,-75.8211588473113,417
__3Z08YI,BLAIR RD btwn MOWAT ST & APPLEFORD ST (__3Z08YI),2023,10957,374221.806868843,5033924.79818312,45.4418070916202,-75.6126009768091,418
